{
  "$schema": "https://json-schema.org/draft/2020-12/schema",
  "$id": "https://github.com/KraidleAI/monark-kata-spec/blob/main/schemas/gate-decision.schema.json",
  "title": "GateDecision",
  "description": "L3 gate decision (consumed by UKEMI), contract 1.1.0. request_sha256 is the digest of the canonical writing of the request envelope as received. intent is string|number|null (the set|interval union does NOT leak, C6): the containment predicate is 'intent in labels' (set) or 'lo <= intent <= hi' (interval). remaining_budget = B_t (remaining conformal authorization capacity), a MONARK attribute, depletable, never a return paid to anyone.",
  "type": "object",
  "additionalProperties": false,
  "required": [
    "schema_version",
    "action",
    "allow",
    "tool",
    "intent",
    "verdict",
    "remaining_budget",
    "request_sha256",
    "reason"
  ],
  "properties": {
    "schema_version": { "const": "1.1.0" },
    "action": { "enum": ["commit", "defer", "abstain"] },
    "allow": { "type": "boolean" },
    "tool": { "type": "string", "pattern": "^[ -~]+$", "minLength": 1 },
    "intent": { "type": ["string", "number", "null"] },
    "verdict": { "$ref": "coverage-verdict.schema.json" },
    "remaining_budget": { "type": "number" },
    "request_sha256": { "type": "string", "pattern": "^[0-9a-f]{64}$" },
    "reason": {
      "enum": [
        "covered",
        "set_too_large",
        "interval_too_wide",
        "intent_not_in_region",
        "under_calib",
        "no_label_schema",
        "budget_exhausted",
        "clock_expired",
        "upstream_timeout",
        "attestation_absent",
        "attestation_refused",
        "binding_broken",
        "non_evaluable",
        "calib_silence",
        "calib_vetoed",
        "calib_retired",
        "out_of_support",
        "region_degenerate"
      ]
    }
  }
}
