{
  "schema_version": "1.1.0",
  "action": "commit",
  "allow": true,
  "tool": "perps_order_preview",
  "intent": "up",
  "verdict": {
    "schema_version": "1.1.0",
    "task_class": "btc-dir-15m",
    "method": "hac-cp",
    "alpha": 0.1,
    "n_calib": 50,
    "region": {
      "kind": "set",
      "labels": [
        "up"
      ],
      "label_schema": "up|down"
    },
    "qhat": 0,
    "qhat_unit": "score",
    "scale": null,
    "abstain": false,
    "reason": "covered",
    "residual": [
      "assume:tls-notary",
      "assume:delegation"
    ],
    "scores": [
      0,
      0,
      0,
      0,
      0,
      0,
      0,
      0,
      0,
      0,
      0,
      0,
      0,
      0,
      0,
      0,
      0,
      0,
      0,
      0,
      0,
      0,
      0,
      0,
      0,
      0,
      0,
      0,
      0,
      0,
      0,
      0,
      0,
      0,
      0,
      0,
      0,
      0,
      0,
      0,
      0,
      0,
      0,
      0,
      0,
      0,
      0,
      1,
      1,
      1
    ],
    "scores_sha256": "f2982784bcad8c9e801781559ddb3bab31ca03e013159dc8665a6acd15e71208",
    "cell_key": null,
    "policy_row_sha256": null,
    "policy_table_sha256": null,
    "produced_at": "2026-09-04T12:00:00Z"
  },
  "remaining_budget": 0.02,
  "request_sha256": "96ced68660235fb8f5bfedf46bfb8f09730f4fa00c16717e8a50c49a7984e159",
  "reason": "covered"
}
