{
  "schema_version": "1.1.0",
  "action": "abstain",
  "allow": false,
  "tool": "perps_order_preview",
  "intent": "up",
  "verdict": {
    "schema_version": "1.1.0",
    "task_class": "btc-dir-15m",
    "method": "hac-cp",
    "alpha": 0.1,
    "n_calib": 10,
    "region": null,
    "qhat": null,
    "qhat_unit": "score",
    "scale": null,
    "abstain": true,
    "reason": "under_calib",
    "residual": [
      "assume:tls-notary",
      "assume:delegation"
    ],
    "scores": [
      0,
      0,
      1,
      0,
      0,
      1,
      0,
      0,
      0,
      1
    ],
    "scores_sha256": "7208078fc683ac985c46377b47890e994386024568a0141a9c113b8d6f331a0c",
    "cell_key": null,
    "policy_row_sha256": null,
    "policy_table_sha256": null,
    "produced_at": "2026-09-04T12:00:00Z"
  },
  "remaining_budget": 0.1,
  "request_sha256": "764a62cd04b92fd74902e1a03a166508296752d5abfb959acb25b5c96c8a7409",
  "reason": "under_calib"
}
